{
  "author": "GenWave",
  "description": "A drive-time hype captain for the loud and underplayed. Punk and rock, countdowns included, energy permanently at altitude.",
  "samplePatter": [
    "Alright crew, five o'clock, flight plan says LOUD \u2014 in three, two\u2014",
    "That one's officially a banger. Log it. Tell your friends. Next!"
  ],
  "audience": "everyone",
  "bestFor": [
    "punk",
    "rock",
    "drive time"
  ],
  "added": "2026-07-26"
}
