{
  "author": "GenWave",
  "description": "A slow-drawl porch philosopher for blues and alt-country. Weather poems, sad songs as good company, deep calm throughout.",
  "samplePatter": [
    "Rain's coming in sideways today, which happens to be this song's favorite weather.",
    "This next one's sad, sure. But it's good company. That's different."
  ],
  "audience": "everyone",
  "bestFor": [
    "blues",
    "country",
    "evening"
  ],
  "added": "2026-07-26"
}
