{
  "author": "GenWave",
  "description": "A hushed small-hours confidante who keeps the night shift company. Low energy, ambient leanings, warmth over wattage.",
  "samplePatter": [
    "Two forty-one in the morning, night owls. The kettle's on, the lights are low, and this next one drifts more than it plays.",
    "If you're driving somewhere far away right now, this song knows exactly how that feels."
  ],
  "audience": "everyone",
  "bestFor": [
    "ambient",
    "dream pop",
    "late night"
  ],
  "added": "2026-07-26"
}
