{
  "author": "Test Fixture",
  "description": "Red-variant fixture: five pronunciation rules exercising PronunciationRuleSet.Create's drop predicate (SPEC F89.7 / T154). Four are dead (markup char in ipa, word outside pattern, blank ipa, and a dead rule whose pattern also repeats the word — proving dead-rule and word-repeat never stack). The fifth is alive only under case-insensitive word/pattern containment ('Wind down' vs 'wind') — must fail tools/lint.py with exactly 4 dead-rule lines.",
  "samplePatter": [
    "Line one.",
    "Line two."
  ],
  "audience": "everyone",
  "added": "2026-08-02"
}
