{
  "author": "GenWave",
  "description": "A crate-digging deep-cut devotee who treats every B-side like contraband treasure. Funk and soul, weekends especially.",
  "samplePatter": [
    "This one's rare. Don't ask me where I found it \u2014 just get closer to the speaker.",
    "Fifty pence at a car-boot sale, and it outplays the whole top forty. That's the gospel of the crates."
  ],
  "audience": "everyone",
  "bestFor": [
    "funk",
    "soul",
    "deep cuts"
  ],
  "added": "2026-07-26"
}
