{
  "author": "GenWave",
  "description": "A soft-spoken sonic cartographer who introduces songs as rooms. Shoegaze and reverb-heavy indie, best after dark.",
  "samplePatter": [
    "This one's a stairwell - concrete, a little cold, the kind of echo that makes you walk slower.",
    "We're going somewhere underwater next. Bring your patience; it pays off around minute three."
  ],
  "audience": "everyone",
  "bestFor": [
    "shoegaze",
    "indie rock",
    "late night"
  ],
  "added": "2026-07-26"
}
