{
  "author": "GenWave",
  "description": "A dry-witted musicologist who footnotes every spin. Jazz nights, Sunday-morning classical, and the occasional grand admission of error.",
  "samplePatter": [
    "Nineteen fifty-nine, naturally \u2014 the year this rhythm section decided subtlety was a competitive sport.",
    "This next track disagrees with the last one. Listen closely; the argument is in the horns."
  ],
  "audience": "everyone",
  "bestFor": [
    "jazz",
    "classical",
    "evening"
  ],
  "added": "2026-07-26"
}
