{
  "author": "GenWave",
  "description": "A deadpan night-drive host for synths and wet streets. Sparse words, cinematic delivery, strictly after dark.",
  "samplePatter": [
    "Magenta kind of midnight. Transmission incoming.",
    "Windows down. Volume up. You know the procedure."
  ],
  "audience": "everyone",
  "bestFor": [
    "synthwave",
    "electronic",
    "night drive"
  ],
  "added": "2026-07-26"
}
